{
  "request_id": "IVR-698F96486264",
  "run_id": "RUN-20260630-42",
  "verdict": "중부적합",
  "validated_by": "적합성검증 팀에이전트",
  "validated_at": "2026-07-29T09:10:00+00:00",
  "recalc_matches": {
    "rwa_final_total": true,
    "cet1_ratio": true,
    "total_ratio": true,
    "leverage_ratio": true,
    "ecl_total": true,
    "lcr": true,
    "nsfr": true,
    "stress_trough_cet1": true,
    "reverse_critical_severity": true,
    "reserve_shortfall": true
  },
  "findings": [
    {
      "finding_id": "F-C01",
      "severity": "중부적합",
      "target": "rwa_final_total",
      "detail": "**요청 패키지가 자기 자신이 실린 커밋에서 재현되지 않는다.** 커밋된 트리(`954191c`)에서 요청서가 지시한 절차(`generate_portfolio(seed=42)` → `run_pipeline(portfolio, seed=42, asof='2026-06-30')` → `build_studio`)를 그대로 실행하면 request_id 가 **`IVR-9FE1167F7A00`** 으로 나와 요청서의 **`IVR-698F96486264`** 와 다르다. 필드 단위로 전수 대조한 결과 **유일한 차이는 가정 [27]** 이며, 그 문장이 담는 문서 대조 커버리지가 '수치 토큰 **1,260**개 중 46개(**3.7%**)' 에서 '**1,349**개 중 46개(**3.4%**)' 로 바뀌었다. 원인을 커밋 단위로 특정했다 — `doc_figures.coverage_sentence()` 가 대조 대상 문서 `RUN-20260630-42.remediation.md` 의 토큰을 세는데, 그 문서에 **13차 절이 요청서와 같은 커밋에서 추가**됐다. 실측: 직전 커밋 `9c4f02b` 시점 토큰 1,260 · 구간 안 46(3.7%) = 요청서 값, 요청서가 실린 커밋 `954191c` 시점 토큰 1,349 · 구간 안 46(3.4%) = 재현값. 즉 **순환 의존**이다 — 문서에는 요청 통계가 생성 구간으로 실리고(F-501 시정), 요청서에는 그 문서의 통계가 실린다(F-B01 시정). 두 시정이 각각 옳았는데 합쳐지자 서로를 낡게 만든다. 이 결함은 **구조적이라 다음 회차에도 반복**된다 — 시정 문서에 절을 덧붙이는 한 매번 어긋난다. 범위를 좁혀 기록한다: 산출값 10종 · `headline_digest`(`3b4b6b31…`) · `submission_digest`(`9d0c6fa3…`) 는 **전부 비트 단위로 재현**되므로 리스크 수치는 무손상이며, 무너진 것은 **요청 식별자의 재현성**이다. 그럼에도 중부적합으로 보는 이유는 셋이다. ① 게이트가 `request_id` 로 요청·응답을 대사하므로 식별자 재현성은 이 교환 체계의 근간이다. ② 3선이 재현해 다른 ID 를 얻으면 '이 요청서가 이 트리에서 나왔다' 를 확인할 수 없고, 그 확인을 12회차까지 매번 '비트 단위 일치' 로 보고해 왔다. ③ 산출값이 정상이라는 이유로 재현성 기준을 낮추면 사후 기준 완화가 된다(ADV-PROC-03). 시정 방향은 넷 중 하나다 — ⓐ 문서 통계를 요청 식별자 산정에서 제외 ⓑ 요청서 생성을 모든 문서 편집 **뒤로** 이동 ⓒ 문서 통계를 고정 리비전에서 측정 ⓓ 커버리지를 문서가 아니라 생성 구간 정본(코드 산출) 기준으로 재정의. ⓑ 는 절차 의존이라 또 어긋날 수 있고 ⓐ·ⓓ 가 구조적이다.",
      "recomputed": 1349,
      "reported": 1260
    },
    {
      "finding_id": "F-C02",
      "severity": "경부적합",
      "target": "reserve_shortfall",
      "detail": "2선이 '등록만 하고 정당성은 판단하지 않았다' 고 남긴 **조·항 혼용 15건을 3선이 판별**했다. 세 부류로 갈린다. ① **항 표기 누락 4종 — 정정 필요.** 같은 항목인데 서식마다 항 표기가 갈린다: [규제 최저비율] 은행업감독규정 제26조 — 제1항 2곳(BR-08/6000 · B2602-2/1300) vs 무표기 1곳(BR-09/4000), [동일차주 한도 초과 그룹 수] 은행법 제35조 — 제1항 2곳(B3103/5100 · B3104/5100) vs 무표기 1곳(BR-33/9000), [잉여(+)·부족(−)] 제26조 — 제1항 1곳(BF605/5000) vs 무표기 1곳(BF602/5000), [자기자본] 은행법 제2조 — 제1항 8곳 vs **무표기 3곳**(BR-27/1000 · BR-28/1000 · B2606/1000). 무표기 쪽 7라인을 표기 있는 쪽에 맞추면 해소된다. ② **오탐 10종 — 조치 불요.** 자회사 8종은 B3110(자회사 소유 현황)이 은행법 제37조 제2항, B3111(자회사 신용공여)이 제3항으로 **서식 성격이 달라** 서로 다른 항이 붙는 것이 정상으로 보이며, [한도금액] 2종(제35조 제1항·제3항·제4항 · 제37조 제2항·제3항)도 같은 이유다 — 다만 규정 원문 대조가 불가하므로 **미확인**으로 남긴다. ③ **지표 오탐 1종** — [비고]는 라인명이 내용을 담지 않아 서로 다른 항목(B2516/9900 · B5102/9000)이 한 키로 묶였다. 지표 자체의 개선안: 키를 `line_name` 단독이 아니라 `(form_id 계열, line_name)` 또는 의미 태그로 좁히면 ②·③ 이 줄어 15건 중 실제 조치 대상 4종만 남는다. 산출값 영향은 없다.",
      "recomputed": 4,
      "reported": 15
    },
    {
      "finding_id": "F-C03",
      "severity": "적합",
      "target": "rwa_final_total",
      "detail": "F-B01 해소, 그리고 **지적의 일반화**. 구조적 원인 진단이 정확하다 — 구조 키 산출이 `tests/` 안에만 있어 `build_request` 에서 부를 수 없었고, 그래서 '요청서에 공시한다' 는 애초에 지킬 수 없는 약속이었다. `risk_lib/regulatory/structure.py` · `citations.py` 로 옮겨 산출 쪽에서 생성해 싣는다. 나아가 **통제 6종을 전수 점검해 3선이 지적하기 전에 2종(인용 등록 · 문서 대조)의 한계 누락을 스스로 찾았다** — ADV-PROC-05('한 건을 고칠 때 같은 유형이 어디에 더 있는지 묻는다')를 자발적으로 적용한 것이다. 3선 독립 재현으로 생성 수치를 전부 확인했다: 구조 통제 `n_lines` 5,896 · `n_keys` 5,854 · `n_folded` **42** · `n_baseline_keys` 5,828 · `key_gap` **+26**, 인용 `n_cited` **5,397** · `n_unique` **473** · `n_no_clause` **2,907** · `n_clause_conflict` **15** — 요청서 문장의 모든 수치와 일치한다. 가정 25 → 28. 특히 '문서 대조는 수치 토큰의 3.7%만 본다' 를 스스로 밝힌 것은 불리한 사실의 자발 공시이며, 7차에 3선이 4.3%로 재던 것을 이제 2선이 매 실행 생성한다.",
      "recomputed": 28,
      "reported": 28
    },
    {
      "finding_id": "F-C04",
      "severity": "적합",
      "target": "reserve_shortfall",
      "detail": "F-B02 해소 확인. '조항 오인용 9건' 을 **8건**으로 정정하고 내역을 분리해 적었다 — 조항 정정 8건(BF202/4020 · BF405/1030 · BF405 루프 5라인 = 7건 제1항→제2항, B2431/1030 = 1건 제2항→제1항)과 조항 명시화 9건(B2506 · B2507)이다. 오차의 원인('3선이 표본에서 찾은 2건이 내가 센 7건에 이미 포함돼 있는데 다시 더했다')까지 기록해 셈법을 남긴 점이 옳다 — 3선이 12차에 산출한 분해와 라인 단위로 일치한다.",
      "recomputed": 8,
      "reported": 8
    },
    {
      "finding_id": "F-C05",
      "severity": "적합",
      "target": "cet1_ratio",
      "detail": "독립 재계산 10/10 일치, 부수 피해 없음. `risk_lib` 산식을 참조하지 않고 원자료에서 재산출 — RWA 구성 합 9,399,913,501,716.785, cet1 0.116423301, total 0.156849205, leverage 0.117126320, ecl 94,531,443,664.95, lcr 1.180709349, nsfr 1.130670860, 대손준비금 33,582,430,343.879578(감독규정 별표 최저적립률 직접 재구성, 차이 0). 스트레스 2종은 이전 회차와 같이 읽어 대조한 것이다. `submission_digest` 가 12차와 동일한 `9d0c6fa354e2b1e8…` 인 것은 이번 시정이 서식 라인을 건드리지 않고 통제 한계 공시만 늘렸기 때문이며 **정합하다** — 12차에 신설한 지문이 서식 내용에만 반응하도록 설계된 대로 동작한다. 자체검증 PASS 60 · WARN 5 · FAIL 0 도 재현 일치한다.",
      "recomputed": 0.11642330105320828,
      "reported": 0.11642330105320828
    }
  ]
}
